{
  "$schema": "https://json-schema.org/draft/2020-12/schema",
  "title": "Cocktail Recipe",
  "type": "object",
  "additionalProperties": false,
  "required": [
    "id",
    "name",
    "description",
    "github",
    "ingredients",
    "directions",
    "image",
    "keywords"
  ],
  "properties": {
    "id": {
      "type": "string",
      "pattern": "^[a-z0-9]+(?:-[a-z0-9]+)*$",
      "minLength": 3
    },
    "name": {
      "type": "string",
      "minLength": 1,
      "maxLength": 120
    },
    "description": {
      "type": "string",
      "minLength": 10,
      "maxLength": 300
    },
    "github": {
      "type": "string",
      "pattern": "^[A-Za-z0-9](?:[A-Za-z0-9-]{0,37})$"
    },
    "ingredients": {
      "type": "array",
      "minItems": 1,
      "items": {
        "type": "object",
        "additionalProperties": false,
        "required": ["quantity", "measure", "ingredient"],
        "properties": {
          "quantity": {
            "type": "string",
            "minLength": 1,
            "maxLength": 30
          },
          "measure": {
            "type": "string",
            "minLength": 1,
            "maxLength": 30
          },
          "ingredient": {
            "type": "string",
            "minLength": 1,
            "maxLength": 80
          }
        }
      }
    },
    "directions": {
      "type": "array",
      "minItems": 1,
      "items": {
        "type": "string",
        "minLength": 1,
        "maxLength": 220
      }
    },
    "image": {
      "type": "string",
      "pattern": "^(https?://.+|[a-z0-9-]+\\.webp)$"
    },
    "source": {
      "type": "string",
      "maxLength": 180
    },
    "keywords": {
      "type": "array",
      "minItems": 1,
      "uniqueItems": true,
      "items": {
        "type": "string",
        "minLength": 1,
        "maxLength": 40
      }
    },
    "createdAt": {
      "type": "string",
      "pattern": "^\\d{4}-\\d{2}-\\d{2}(?:T\\d{2}:\\d{2}:\\d{2}Z)?$"
    }
  }
}
