{
  "id": "dry-martini",
  "name": "干马天尼",
  "description": "以金酒与干味美思构成的标志性经典，风格利落清爽，草本与杜松香气清晰直接。",
  "github": "terenzzzz",
  "ingredients": [
    {
      "quantity": "60",
      "measure": "毫升",
      "ingredient": "金酒"
    },
    {
      "quantity": "10",
      "measure": "毫升",
      "ingredient": "干味美思"
    }
  ],
  "directions": [
    "在调酒杯中加入冰块、金酒与干味美思。",
    "充分搅拌至冰镇后滤入冰过的马天尼杯。",
    "以橄榄或柠檬皮作为装饰后出杯。"
  ],
  "image": "dry-martini.webp",
  "source": "国际调酒师协会官方配方",
  "keywords": [
    "经典",
    "搅拌",
    "金酒",
    "餐前"
  ],
  "createdAt": "2026-04-15"
}
